grate,y,y,y,n,y,"reja, alcantarilla, chimenea, calefacción, ventilación","grata, tombino, focolare, grate, griglia",y,"哪些, 筯, 爐裡, 排水, 壁爐","cống, lưới, nắp, lò, thơm_lừng","格子, 強力, 摺り下ろ, マンホール, ニンジン","잡, 대쪽, 환기, 천장, 강판","ท่อระบายน้ำ, ลอดผ่าน, ท่อน้ำ, รั้ว, ข้างล่าง","perapian, parut, Jeruji, jerujinya, ventilasi","ızgara, ızgaraya, ızgarası, şöminenin, kanalizasyona","المشبك, مشبك, الحديدي, الفتحة, حاجز","באח, הביוב, הסבכה, הסורג, לביוב",n
bead,y,y,y,"бисер, бусина, мушке, прицеле, бусы","Perle, Perlen, Visier, Spur, drauf","perla, Chu, rosario, apuntando, aliento",y,y,y,"hạt, chuỗi, lỗ_đít, giọt, nhắm",y,"), (, #, 조심, 멋",y,"manik-manik, manik, mutiara, manik-manikku, pagoda",y,y,y,n
knitting,y,"kutoa, kudon, neuloo, Neulon, neulomaan",y,y,y,y,y,y,y,"đan, len, móc, lớp_học, kim_đan",y,"뜨개, 질, 짜, 뜨개질, 길래요","ถัก, นิตติ้ง, เข็ม, lobotomy, ลาย",y,y,y,y,n
knitting needle,n,n,n,n,n,n,n,n,n,n,n,n,n,n,n,n,n,n
pom-pom,"elcsórták, hegyére, szoknyás, áztatta, üvegszilánk",n,n,n,n,n,y,n,n,"cổ_vũ, bông, quả, Huấn_luyện_viên, giỏi",n,""", 팜, Wampum, pom, 얘","ปอม, เชียร์, พู่, มานั่น, เรื่องกองเชียร์",n,n,"بوم, التشجيع, المشجعات, البوم, يجيد","פום, המעודדות, מעודדת, ומשופד, אסקור",n
tiara,y,y,y,y,"Diadem, Krone, trug, Zum, Miss",y,y,y,"皇冠, 王冠, 發卡, 戴, 耿","vương_miện, mũ_tiara, sơ_sinh, trang_sức, Vòng_tay",y,y,"มงกุฎ, ฏ, รัดเกล้า, มง, กุ",y,y,y,"נזר, הכתר, כתר, וכתר, מהכתר",n
crayfish,"rák, rákot, rákok, folyami, homárt",y,y,y,"Krebse, Langusten, Scheren, reingeworfen, Aggression",y,y,y,"蝦, 小龍, 龍, 不吃, 螯",y,y,"가재, 오믈렛, 쇠고기, 내오, 믈","กุ้ง, แม่น้ำ, เค, ของกุ้ง, เกลี้ยง",n,y,"جراد, البحر, روبيان, الجراد, سلطعون","נהרות, סרטני, סרטן, הנהרות, סרטנים",n
chalice,"kelyhe, amaz, tanítványainak, Hasonlóképpen, midőn","malja, pikari, maljan, pikarin, maljasta",y,y,"Kelch, Fächer, Giftperle, nippt, Fechten",y,y,y,y,"ly, cốc, rượu, lễ, chén","聖杯, ""er"", o, ブレード, 記述",y,y,y,y,y,"הגביע, גביע, כמוסת, העלי, בגביעון","प्याले, बढ़ाओ, आगे, मुझसे, यदि"
mug,y,"mukin, mukissa, mukia, ryöstää, naamaasi",y,y,"Becher, Visage, Krug, Kaffeetasse, Fresse","jeta, jarro, jarra, ficha, policiales",y,y,"杯子, 一杯, 杯, 檔案, \ue1ae","cốc, bản_mặt, Cốc, khờ, C","マグ, カップ, 写真, 顔, 取調べ","컵, 머그, 사진, 바보, 낯짝",y,y,y,y,y,y
pepperoni,n,n,n,n,n,n,n,n,"香腸, 竮, \ue717, 欢, 火腿","pepperoni, Pepperoni, tiêu, bò, Đăng_ký",y,y,"โร, ปอ, เปปเ, นี, เปอร์",y,n,n,"פפרוני, פיצה, ופטריות, הפטריות, פיצות",y
scissors,y,y,y,y,"Schere, Scheren, Echse, schneiden, Messer",y,y,y,y,y,y,y,y,y,y,y,y,y
cream cheese,n,n,n,n,n,n,n,n,n,n,n,n,n,n,n,n,n,n
diskette,n,n,n,n,n,n,n,n,n,n,n,n,n,y,n,n,n,n
ribbon,y,y,y,y,"Band, Schleife, Farbband, rotes, blaues",y,y,y,y,"dải, ruy_băng, dải_băng, băng, khánh_thành",y,y,y,y,"kurdele, kurdeleyi, Kurdele, kurdela, kurdeleyle",y,"סרט, הסרט, הרצועה, וסרט, רצועה",y
sequin,n,n,n,"блестками, блёстками, сверкающее, диадеме, портным",n,n,n,n,"閃, 上衣, 亮, 那件, 主婦","♫, bản_gốc, khoét, Giữa, đệt","服, 見当, 忘れ, 入れ, つ",n,n,"kotak-kotaknya, jaketku, casing, pencocokan, korsase",n,"موضه, لنناقشها, وحمالة, بولس, مرفوعة","נצנצים, הנצנצים, נוצצת, דיסקו, תשמיטי",n
sticker,y,"tarraa, repussa, lapun, Autossa, luki","προφυλακτήρα, αυτοκόλλητα, χαρτάκι, παρμπρίζ, ετικέτα",y,"Stoßstange, kleben, drauf, seinem, Wagen",y,"adesivo, paraurti, adesivi, etichetta, targa",y,y,"nhãn, dán, bảng, balo, tờ_rơi","ステッカー, 貼, バンパー, さて, 勇気",y,y,y,y,y,y,n
poster,y,"julisteen, julistetta, julisteessa, julisteesta, julisteeseen",y,"плакат, плакате, плаката, постера, плакатом","Poster, Plakat, Aushängeschild, Steckbrief, hängt",y,y,y,y,y,y,y,y,y,y,y,y,y
tinsel,y,"koristeita, koristeet, keinotekoisen, loisteen, säkeisiin",y,y,"Lametta, Tingeltangel, Glitter, Flitterthron, krallt",y,"decorazioni, addobbi, decorazione, lamé, orpelli",y,"絲, 誕氣氛, 船艙, 這球, 玩法","trực_giác, mềm_yếu, linh, kệch_cỡm, siêu","若造, ピッタリ, 派手, モノ, 最強","반짝, 아도, 상관없, 누가, 좋",n,"perada, Christmasy, antenac, pereda, Rudolph","süs, bicili, cicili, telleri, Süs","الأشرطة, الملونة, الزينة, المبهرجة, بالزينة","קישוטים, נצנצים, הקישוטים, צעקניים, קישוט",n
stained glass,n,n,n,n,n,n,n,n,n,n,n,n,n,n,n,n,n,n
denture,n,n,n,n,n,n,n,n,n,n,n,y,y,n,n,n,n,n
retainer,y,"hammasraudat, ennakkomaksun, ennakkoa, ennakkomaksu, etumaksun","προκαταβολή, σιδεράκια, ακόλουθός, ακόλουθο, υπηρέτη",y,"Vorschuss, Zahnspange, Gefolgsmann, Spange, Honorar",y,"apparecchio, onorario, acconto, anticipo, servitore","acompte, dentaire, provision, appareil, honoraires","聘用, 定金, 預付, 費, 家臣","đặt_cọc, lưu_giữ, Tiền, 100,000, công",y,"의뢰, 비용, 수임료, 10, 태너","ยึด, ค่าจ้าง, เนอ, retainer, ิเ","upah, pengikut, penahan, Pelayan, jasaku",y,"عربون, أتعاب, مقدم, العربون, تقويم","טרחה, שכר, הטרחה, הפלטה, המקדמה","सेवक, नागरिक, आधार, दर्ज, शिकायत"
toothpaste,y,y,y,"зубной, паста, пасту, зубная, пасты","Zahnpasta, Tube, Zahncreme, Zahnbürste, Zahnpastatube","pasta, dentífrico, dental, tubo, afeitar",y,y,y,"răng, đánh, kem, bàn_chải, tuýp","歯磨き, 粉, ブラシ, 歯, ハミガキ",y,y,y,y,"معجون, الأسنان, أسنان, الاسنان, اسنان","משחת, שיניים, במשחת, ומשחת, למשחת",y
banana split,n,n,n,n,n,n,n,n,n,n,n,n,n,n,n,n,n,n
brownie,n,n,n,n,"Brownie, Pluspunkte, Keks, grad, bestellt",n,n,n,"蛋糕, \ue1ab, ガ, 巧克力, ェ","bánh, la, hạnh_nhân, bánh_sô, thiện","点数, 稼ぎ, 代行, てん, フラペチーノ",y,"บรา, วน, ี่, กัญชา, เค้ก",y,n,y,y,"सद्भावना, नाज़ी, जमा, छिपने, तब"
creme brulee,n,n,n,n,n,n,n,n,n,n,n,n,n,n,n,n,n,n
cupcake,n,"leivoksen, leivos, muffini, muruseni, leivoksia",n,y,"Törtchen, Muffin, Süße, Kuchen, Max",n,y,n,y,"bánh, bánh_nướng, kỳ_công, Gậy, Công_thức","ケーキ, カップ, ホモ, 野郎, ちか","컵, 케익, 컵케이크, 케잌, 관점","เค้ก, คัพ, ขนมเค้ก, cupcake, ชั้นเรียน",y,n,n,"העוגות, דובשנית, עוגיה, עוגייה, לעוגות","पोस्टर, दीवार, पर, और, ."
flan,n,"vanukasta, vanukas, torttua, vanukkaasta, piirasta","τάρτα, πέταλο, κακής, Γλυκό, Ωρα",n,n,y,"sformato, budino, capirò, cosmico, tortino",y,"布丁, que, un, """", autre",y,n,"캐러멜, 푸딩, 바닐라, 과, 사이","ขนม, หมั้..., คัสตาร์ด, แป้ง, ลาน",y,y,n,n,n
fruitcake,"gyümölcstortát, gyümölcskenyér, gyümölcstorta, piskóta, gyümölcsös","hedelmäkakkua, hintti, Devery, Kahjo, Ethel","κέικ, φρούτων, τρελάρα, θεοπάλαβος, κεικ","фруктовый, кекс, пирог, фруктовым, фруктовых","Obstkuchen, Spinner, Fruchtkuchen, Stollen, Nuss","frutas, chiflado, pastelito, bizcocho, chiflada","frutta, Devery, svitata, svitato, panettone","cake, fruits, cakes, givré, pédale","蛋糕, 水果, 縷, 矹, く",y,"フルーツ, ケーキ, 乱痴気, クレージー, オカマ","후르츠, 케익, 꼬, 걸요, 똥","เค้ก, ฟรุต, ประสาท, หัว, แหง ๆ","kue, fruitcake, buah, kuenya, sinting","meyveli, kek, Meyveli, keki, keke","الفواكه, كعكة, فواكه, كيكة, بالفاكهة","עוגת, פירות, הפירות, מעוגת, ועוגת",n
mousse,n,y,n,n,"Schaum, au, gießen, Risiken, Truthahn",y,n,y,"科拉, 螺母, 覆盆子, 芙, 椰子","kem, Kem, dâu, cá_hồi, chuyên_gia_bảo_vệ",y,y,y,"mousse, gel, strawberry, Gomorrah, mengendurkan",n,y,"מוס, המוס, במוס, סלמון, -מוס",n
parfait,n,n,"παρφέ, πουτίγκα, Πεκινουά, πιάτο., απόλυτης","десерт, яка, отказывался, Превосходно, предлагал",n,"postre, habas, yak, Postre, soufflé","budino, mousse, yogurt, dalmata, pechinese","parfait, génoise, pudding, yaourt, pékinois",y,"bánh, nước_miếng, rủ, chảy, từ_chối",y,n,"พาร์, เฟต์, มากอยู่แล้ว, เฟ่, เริ่ด",y,n,"بارفيه, البارفيه, طبقة, فــقــط, مخللات","פרפה, קינוח, פירות, יוגורט, פודינג",n
sundae,"karamellás, gyümölcsös, habos, cseresznye, tortán","kastikkeen, kermavaahdon, kuumalla, jäätelösi, ilmaisen","κερασάκι, φρούτι, τούτι, γαρνιτούρα, σιρόπι","фруктами, сиропом, пломбиром, сливочное, тройное","Eisbecher, Kirsche, Milkshake, Karamelleis, Becher","cereza, fresa, caramelo, nueces, frutas","coppa, ciliegina, ciliegia, brownie, roast",y,y,"kem, mứt, sundae, dâu_tây, trái_cây",y,"아이스크림, 줘, 그랬, 군, 멍청",y,y,"meyveli, Meyveli, sicak, kiraz, dondurmamı","صنداي, الكرز, بالفراولة, البوظه, ساندي","סאנדיי, גלידת, פאדג, הדובדבן, דובדבן",n
tiramisu,n,n,n,n,n,n,n,n,"提拉, 米, 蘇, 我何, 吃些",y,n,y,"ทีรามิสุด้วยกัน, เคลิบเคลิ้ม, นัวเนีย, ทิ, เผลอ",y,n,n,n,n
wedding cake,n,n,n,n,n,n,n,n,n,n,n,n,n,n,n,n,n,n
fudge,"karamellát, karamellás, tejkaramella, karamella, tejkaramellát","toffeeta, kermakaramellia, hemmettiin, hitsi, haistanut","παντεσπάνι, γλυκάκι, σιρόπι, σοκολατάκια, Ζεστό","ириски, стряпня, сиропом, шоколадным, блин","Fudge, Karamell, Toffee, Eisbecher, Schlagsahne","Caramelo, jarabe, caramelo, nueces, caramelos","caramello, cappero, falsificare, Dietro, fuso",y,y,"kẹo_mềm, địt, giòn, mứt, la",y,y,"ฟัด, จ์, ซันเดย์, บรา, ขนม",y,"şekerleme, paketleyicisi, Şekerleme, şekerlemeleri, cevizli","الفودج, بالحلوى, حلوي, والحلوى, الحلوي",y,"हल्वा, मीही, नारियल, दाना, केक"
whipped cream,n,n,n,n,n,n,n,n,n,n,n,n,n,n,n,n,n,n
baklava,n,y,n,n,n,n,n,n,n,"bánh, Baklava_ăn, ởJaffa, Caviar_bíp, bánh_mật_ong",n,n,"วาวา, เปอร์เซีย, บก, ขนม, อาหาร",n,n,y,"בקלאווה, קוויאר, some, ביפו, huh",n
birthday cake,n,n,n,n,n,n,n,n,n,n,n,n,n,n,n,n,n,n
pastry,y,y,"ζύμη, ζαχαροπλαστείο, πάστα, σεφ, γλυκάκι",y,"Gebäck, Konditor, Teig, Konditorin, Blätterteig","pastelería, pastelero, pastelito, chef, pasteles",y,y,y,"bánh, ít, bánh_nướng, ngọt, đậu_khấu","菓子, パン, 屋, 職人, ドルチェ","패스, 츄, 리, 여우야, 제빵",y,"kue, kering, koki, chef, Tukang","hamur, Hamur, Pasta, pastacı, pastanede",y,y,y
pie,y,y,y,y,"Kuchen, Pastete, Pie, Kirschkuchen, pie","pastelero, Pastel, Tarta, pay, calabaza","crostata, tortino, pasticcio, Torta, zucca","tarte, tourte, pâtissier, Tarte, pie",y,y,y,y,y,y,y,y,y,"पाइ, बचेगी, पसंद, केक, चार्ट"
popsicle,"nyalókát, jégkrémet, jégcsap, Fasírt, jégkrém","jäätelön, rinnalleni, jäätelötikun, postilaatikon, Jäätelötikuista",n,n,"Eis, Stiel, basteln, Box, heißer","paleta, polo, palitos, volemos, palito",y,"sucette, esquimau, bâtonnet, glacé, glacée","冰棒, 冰棍, 來根, 小美女, 一根",y,"アイス, キャンディー, 棒, キャンデー, 溶か",y,y,"es, loli, krim, mengubahmu, sarung","buzlu, dondurma, Buzlu, dondurmaya, dondurmayı",y,y,n
sorbet,n,y,n,n,n,n,n,n,"屡, ︹, 瞏, \ue6a8, 狦","món, Amareto, lựu, pudding, giòn",y,y,"เชอ, ร์เบ็, ร์เบ็ต, กินน้ำ, เบ็","Sorbet, ceri, ♫, serbet, nakal",n,"الليمون, الشربات, الغازي, المانجو, which",n,n
napkin ring,n,n,n,n,n,n,n,n,n,n,n,n,n,n,n,n,n,n
chinaware,"Edényeket, porcelánt, porcelánok, 2400, utánzatot",n,n,"звонкого, подходит., свитков, фарфора, ваза",n,y,n,"porcelaine, Réduis, camelotes, estampes, trafiquées",n,n,n,n,n,n,"porselenlerini, Nur, parşömen, Arasında, bitik",n,n,n
mud,y,"mutaa, mudassa, mutaan, mudan, mudasta",y,y,"Schlamm, Matsch, Lehm, Schmutz, Dreck",y,y,y,y,y,"泥, 泥まみれ, だらけ, まみれ, 沼",y,y,y,"çamur, Çamur, çamura, çamurda, çamurun",y,y,n
saucer,y,y,y,y,"Untertasse, UFO, Schälchen, Teller, Fliegende",y,y,y,"碟型, crashed, 艦身, 碟, 墊","đĩa_bay, đĩa, dĩa, tách, shit","円盤, 皿, ドブネズミ, カップ, 空","원반, 부, 분리, 쥐, 받침",y,"piring, sepiring, terbangmu, terbangnya, piringan","Gövde, tabağı, gövde, Tabağı, Fincan",y,"צלחת, מעופפת, צלוחית, בצלחת, לצלחת",n
scuba,"búvárkodni, búvár, búvárruha, könnyűbúvár, búvárruhát",n,n,"подводное, нырять, плавание, подводного, нырял",n,n,"immersioni, sub, immersione, subacquea, muta",n,y,"lặn, thợ, kịp_thời, phà, bó",y,y,"ดำน้ำ, ลึก, ยส์, ิ้ล, โรงเรียน",y,n,"الغطس, الغوص, غوص, للغوص, غطس",y,n
turntable,y,y,y,y,"Plattenspieler, Schallplatte, Drehscheibe, Sota, motorisiert",n,y,n,"72, ╃, 芥, 頻器, 唱機","xoay, bàn, lô, đĩa, 72",y,y,"หมุน, จากล็อต, ล็อต, รายการสุดท้าย, 72",y,n,"الدوار, القرص, أسطوانات, اسطوانات, قرص","פטיפון, המסתובב, הפטיפון, המסתובבת, בפטיפון",n
chihuahua,n,n,n,n,n,n,n,n,"吉娃娃, \ue07a, \ue00e, \ue6b4, 這只",n,y,y,"ชิ, พันธุ์, วาวา, วาว่า, สุนัข",y,n,n,n,n
dalmatian,n,n,n,"разводить#, Далматинцев, Выберете, #Как, Волге",n,n,n,n,"斑點, 這來, 小狗, 親親, 狗",n,n,"티켓, 통로, 혹시, 쪽, 도",n,y,n,n,"דלמטיים, גורים, -צפוף, בוולגה, והשרוכים",n
poodle,"pudli, pudlit, pudlija, pudlival, pudlinak",y,"κανίς, σκυλάκι, σκυλίτσα, κουτάβι, Γαλλικό",y,"Pudel, französischer, dicken, rosa, Einen",y,y,y,"狗, 獅子, 貴賓, 犬, 貴婦","chó, xù, Chó, lông, khiêng",y,y,"พุด, เด, ิ้ล, พู, กระโปรง",y,"fino, Kaniş, takatukaları, Kanişe, köpeğine","بودل, البودل, ككلب, كلبة, وكلب",y,n
pug,"kutyás, pisze, Isabelle, bunyósból, balekunk","nyrkkeilijä, haukuttu, pönttö, Isabelle, rumaksi","σκυλομούρα, Λόλα, ασχημόφατσα, μποξέρ, αντιπαθή",y,"Boxer, Isabelle, Zöpfen, Bauten, Kinderwagen","cerdito, arrastrada, faldero, feísimo, púgil","pugile, Cinco, Lola, gallo, Isabelle","boxeur, retroussé, ingrat, tatouage, vilain","哈巴狗, 伊莎貝爾, 混種, 米格, 黑陀",n,y,"퍼그, ?","เยี่ยว, หางกุด, จุกออกมานอก, แรมโบ้, ถึงกับ",y,"buldog, boksör, cinsi, buldogu, Lola","القبح, الملاكم, ملاكم, كلبة, نصفه",y,n
doorknocker,n,n,n,"дверной, молоток, замка, штуковине, обстановки",n,"aldaba, tirador, picaporte, ariete, instale",n,n,n,n,n,n,n,n,"tokmağı, kapı, Pirinçten, taktığınız, apartmanın",n,n,n
doorknob,y,"Ovenkahva, ovenkahvasta, nuppia, kahva, nuppi","πόμολο, χερούλι, πόμολα, χερούλια, πόρτας","ручку, дверной, ручка, дверную, ручке","Türgriff, Türklinke, Socke, Rütteln, Klinke",y,y,"poignée, poignées, serrure, bouton, chaussette","把手, 手上, 擦拭, 在門, へ","cửa, nắm, khung, chót, 19","ノブ, ドア, ･, 335, 括","손잡이, 문, 녹이, clicking, 망가뜨렸","ลูกบิด, หมุน, ถุงเท้า, ็ป, บ่งบอกว่า","pintu, gagang, kenop, ganggang, pegangan","tokmağı, kolu, tokmağına, koluna, tokmağını","مقبض, مقابض, المقبض, قبضة, الابواب","ידית, הידית, בידית, לידית, רעשנים",n
keyhole,y,"avaimenreiästä, avaimenreikää, avaimen-, Avaimenreiän, Ovessani",y,"скважину, замочную, замочной, скважина, скважины","Schlüsselloch, guckte, Satelliten, Durchs, schaust",y,y,y,"鑰匙, 孔, 眼看, 過鎖, 鎖眼","khóa, lỗ, ổ, soi_rọi, khoá",y,"구멍, 열쇠, 틈새, 유두, 키홀","กุญแจ, รู, ผ่านรู, ขุด, ไขกุญแจ","lubang, kunci, saxophone, mengintip, Blows","deliğinden, deliği, Anahtar, deliğini, deliğine","ثقب, تسترق, فتحة, كاشف, يختلس","חור, המנעול, מנעול, לחור, לווין","गोता, ताली, लगाने, माध्यम, अब"
revolving door,n,n,n,n,n,n,n,n,n,n,n,n,n,n,n,n,n,n
trapdoor,"csapóajtó, csapóajtót, Kóla, Mina, Buzz","luukun, luukusta, lattialuukku, luukku, salaluukun",y,"люк, потайной, люка, лаз, могильшик","Falltür, Geheimtür, FaIItür, Luke, öffnete",y,y,y,"暗門, 狾, 炸得, 半開, 暗門蓋","cửa, sập, bẫy, đậy, 75",n,"스프링필드, 로잘리, 안장, 클레, 라이플",y,"pintu, jebakan, tingkap, pintunya, berkisar",y,"المسحور, عنكبوت, الفخ, كولا, نقطه","סתרים, הסתרים, המלכודת, נסתרת, שמינה",n
raisin,y,y,y,y,"Rosine, Rosinen, Rosinenbrot, Zimt, Satan","pasas, uva, avena, uvas, Galletas",y,y,y,"nho, khô, bột, Raisin_Bran, Hmm_...",y,y,y,y,"üzüm, üzümlü, Kuru, üzümü, üzüme",y,y,n
eggnog,y,"munatotia, munatotin, Munatoti, totia, mistelinoksan","έγκνογκ, eggnog, χτυπητό, λικέρ, κάλαντα","гоголь-моголь, яичный, коктейлем, коктейль, яичным","Eierpunsch, Eierlikör, Punsch, Sherry, getrunken",y,y,"poule, lait, chants, buvait, alcool",y,"trứng, rượu, tiệc_rượu, ngô, Rượu",n,"노, 그, changing, 던져, 넣","เอ, ๊อค,, ็, กน, เหล้า",y,"yumurtalı, likörü, Yumurtalı, egnog, kokteyli","البيض, شراب, مخفوق, وشراب, المخفوق","ליקר, ביצים, חלמונה, חלמונית, חלמונים",n
hot-air balloon,n,n,n,n,n,n,n,n,n,n,n,n,n,n,n,n,n,n
lemonade,y,"limonadia, sitruunamehua, limsaa, limonaatia, mehua",y,y,"Limonade, Limo, Zitronen, Zitrone, Eistee",y,y,y,y,"chanh, nước, chanh_ko, chanh_bự, Cà_phê","レモネード, －, うま, サイード, デズモンド",y,"มะนาว, น้ำ, คั้น, เลมอน, มีน้ำ",y,y,"الليمون, عصير, ليمون, الليموناضة, الليمونادة",y,n
soda,y,"limsaa, limua, soodaa, soodavettä, ruokasoodaa",y,"содовой, содовую, газировку, газировки, содовая","Soda, Limo, Limonade, Backpulver, Sodawasser",y,y,y,y,y,y,y,y,y,y,y,y,y
flask,y,"taskumatti, taskumatin, taskumattini, taskumattisi, pulloni",y,"фляжку, флягу, фляжки, фляга, флакон","Flachmann, Fläschchen, Flasche, Thermoskanne, Thermosflasche",y,y,y,"酒瓶, 瓶, 龍舌酒, 瓶子, 隨身","bình, chai, chưng_cất, dung_tích, đun",y,"술병, 휴대, flask, *, 용",y,y,"matara, şişesi, matarayı, şişemi, mataramı",y,y,n
soda fountain,n,n,n,n,n,n,n,n,n,n,n,n,n,n,n,n,n,n
swizzle stick,n,n,n,n,n,n,n,n,n,n,n,n,n,n,n,n,n,n
teabag,n,n,n,n,n,n,n,n,n,"túi, trà, công_đoạn, màu_nước, nhúng",n,n,n,n,n,n,n,n
latte,"tejeskávét, vaníliás, zsírszegény, tejes, szója",n,"latte, Λάτε, μόκα, άπαχο, αφρό",y,n,y,"macchiato, cappuccino, caffellatte, caffelatte, soia",y,"鐵, 拿, 咖啡, 咖啡因, 香草",y,y,y,"ลาเต้, กาแฟ, โฟม, ไขมัน, Latte",y,"sütlü, yağsız, Yağsız, köpüksüz, vanilyalı","بالحليب, بحليب, اللاتيه, الدسم, اتيه",y,n
goblet,y,y,y,y,"Kelch, Becher, Pokal, Füllt, trinkt",y,y,y,"盃, 酒杯, 火, 簗, ‵",y,y,"잔, goblet, me, my, the","ถ้วย, ของเหลว, ใบ, ต้องดื่ม, ทุกคนพูดว่านาย","piala, gelas, cawan, Semuaorang, ale",n,"الكأس, القدح, قدح, بكأس, كأسك","גביע, הגביע, מהגביע, בגביע, שמין",n
chopsticks,"evőpálcikákat, pálcikákat, pálcikák, pálcika, kanál","syömäpuikkoja, puikoilla, syömäpuikoilla, puikot, Puikot",y,y,"Stäbchen, Zeigefinger, Fingern, chinesischen, isst",y,y,y,y,y,y,y,y,y,y,y,"מקלות, אכילה, ופסטיקס, במקלות, האכילה","चॉपस्टिक्स, आया, ले, तुम्हारी, था"
fuse,y,y,y,y,"Sicherung, Lunte, Sicherungskasten, Zündschnur, Zünder",y,y,y,y,y,"ヒューズ, 点火, 導火, 線, ボックス",y,y,y,y,y,y,y
light switch,n,n,n,n,n,n,n,n,n,n,n,n,n,n,n,n,n,n
cable,"kábel, kábelt, kábelen, kábelre, kábeleket","kaapeli, kaapelia, kaapelin, Kaapeli, vaijerin",y,y,"Kabel, Telegramm, Seil, dieses, vom",y,y,y,y,y,y,y,"เคเบิ้ล, เคเบิล, สาย, โทรเลข, เคเบิลทีวี",y,y,y,y,y
cord,y,y,y,y,"Nabelschnur, Rückenmark, Kabel, Schnur, Verlängerungskabel",y,"cordone, spinale, midollo, prolunga, vertebrale","cordon, épinière, moelle, rallonge, vertébrale",y,"dây, tủy, sợi, cung, rốn",y,y,"สายสะดือ, ไขสันหลัง, สายไฟ, เส้นประสาท, สายรก","kabel, tali, tulang, sumsum, pusar","göbek, Göbek, kablosu, kordonu, omurilik",y,"הטבור, השדרה, כבל, הכבל, חוט","गर्भनाल, गले, बंधे, उसके, में"
power line,n,n,n,n,n,n,n,n,n,n,n,n,n,n,n,n,n,n
outlet,"kivezető, gőzt, kreatív, média, elektromos","pistorasia, pistorasiaan, luovaa, ulospääsyä, purkaa",y,"розетка, розетке, розетки, розеткой, торговый","Ventil, Steckdose, Steckdosen, Stecker, Ausweg","tomacorriente, desahogo, válvula, creativa, escape","sfogo, sbocco, valvola, sfogare, creativo","exutoire, débouché, créatif, commercial, médias",y,"ổ_cắm, điện, cắm, lối_thoát, phương_tiện","モール, 大手, 訴え, 河口, 端子",y,"ปลั๊กไฟ, วิก, ระบาย, ร้านทำ, แสดงออก",y,"priz, prize, prizi, ucuzluk, mağazasından","منفذ, مخرج, مقبس, متنفس, المنفذ","פורקן, שקע, לשקע, השקע, עודפים",n
charger,"autós, lemerült, hagytad, találom, Szükségem","reumaattinen, Polttoaineen, akun, valkoisella, saatavilla","πιατέλα, ασημένια, καλώδιο, μπαταρία, Tο",y,"aufladen, Akku, weggenommen, Ross, leer",y,y,"chargeur, destrier, Charger, batterie, cheval","\ue658, 竟, 管連線, 輸入, 燃料","sạc, Sạc, xạc, ngựa_chiến, nạp",y,y,y,y,y,y,y,n
plug,y,"töpselin, töpseli, kytkeä, pistoke, tulppa",y,"розетки, штепсель, подключить, вилку, подключиться","Stecker, Stöpsel, Steckdose, einstecken, stopfen",y,y,"brancher, bouchon, débrancher, débranche, bougie",y,y,y,"플러그, 꽂, plug, 뽑, 전원",y,y,y,y,y,y
computer screen,n,n,n,n,n,n,n,n,n,n,n,n,n,n,n,n,n,n
metal detector,n,n,n,n,n,n,n,n,n,n,n,n,n,n,n,n,n,n
modem,n,n,n,n,n,n,n,n,"秸, 籹, 竟, 數據機, 秆","modem, t, tín_hiệu, ch, đường_dây",y,n,y,y,n,n,"ומודם, פקס, מובנה, מודרנית, שרפתי",n
tablet,y,"tabletin, tabletti, laatan, laatta, taulu","πλακέτα, ταμπλέτα, χάπι, πινακίδα, υπολογιστή","пластину, пластина, таблетку, Планшет, табличка","Tafel, Tablette, Tablett, Kevin, Diese","tableta, tabla, tablilla, comprimido, pastilla",y,"tablette, comprimé, cachet, tablettes, table",y,"phiến, đá, tấm, bảng, bùa",y,y,"แผ่น, จารึก, tablet, จารึกนั่น, แท็บเล็ต",y,y,y,y,"गोली, ले, लो, बाद, भोजन"
cd player,n,n,n,n,n,n,n,n,n,n,n,n,n,n,n,n,n,n
remote control,n,n,n,n,n,n,n,n,n,n,n,n,n,n,n,n,n,n
