thrifty,y,y,y,"мускулы, бережливые, сброд, гожий, Петро",y,y,y,y,y,"tằn_tiện, quý_trọng, nhượng, kiểm, ôn","倹約, 家, ちゃん, 取, 物",n,n,y,y,y,"חסכני, חסכנים, החיסכון, שמב, וכר",y
sane,y,"järjissäni, järjissään, tervejärkinen, järjissäsi, täysjärkinen","λογικός, σώας, φρένας, σώφρων, τας",y,y,y,y,y,"理智, 清醒, 正常人, 正常, 醇","tỉnh_táo, sáng_suốt, bến, khỏe_mạnh, tâm_thần","正気, まとも, 正常, 保, マトモ",y,y,y,"aklı, Aklı, başımda, başında, Aklım",y,"שפוי, שפויה, שפויים, השפוי, השפויה",n
rational,y,y,y,y,y,y,y,y,y,y,y,"이성, 합리, 적, 들으면, 논리",y,y,y,"عقلاني, عقلانية, العقلاني, عقلانياً, عقلانيين","רציונלי, רציונלית, רציונלים, הרציונלי, הגיונית",y
dizzy,"szédülök, Szédülök, szédülni, szédül, megszédültem","huimaa, pyörryttää, huimata, Huimaa, huimasi",y,"кружится, голова, закружилась, головокружение, Голова",y,y,"vertigini, gira, stordito, stordita, capogiro",y,"頭暈, 穡, 點頭暈, 點暈, 有點暈",y,"めまい, 目眩, 目まい, フラフラ, くらくら","어지럽, 어지러워, 어지러웠, 어지러워서, 어지러우",y,y,"dönüyor, başım, Başım, döndürüyor, sersemlemiş","بالدوار, بدوار, الدوار, دوار, بالدوخة","סחרחורת, מסוחרר, מסוחררת, סחרחורות, לסחרחורת",y
crazy,"őrültséget, megőrültem, Megőrült, megőrülök, megőrültél","hullut, Hullua, hullun, seonnut, hulluna","τρελές, τρελοί, Τρελάθηκες, τρελαίνει, τρελά","сумасшествие, сумасшедшие, сумасшедшей, сумасшедшим, сумасшедшая","verrückten, verrückte, irre, Wahnsinn, wahnsinnig","locas, locos, volviendo, locura, vuelve","pazzesco, matta, matti, pazzia, impazzito","cinglé, folie, dingue, folle, rend",y,"điên, điên_rồ, điên_khùng, Điên, khùng","狂, おかし, 正気, イカれ, クレイジー",y,"บ้า, เป็นบ้า, คลั่ง, คนบ้า, เพี้ยน",y,"Delisin, Çıldırdın, delirdin, delisin, çıldırmış","جنونية, مجنونه, مجنونا, جنونياً, مجنوناً","המטורפת, המשוגע, משתגע, השתגעת, טירוף","पागल, पागलपन, लगूंगा, सनकी, आओ"
sober,y,y,y,y,y,y,y,y,y,y,"回復, 支援, しらふ, シラフ, 中毒","술, 정신, 금주, 끊, 맨",y,"sadar, mabuk, siuman, waras, alkohol",y,"الرصين, صاحية, صاحي, صاحياً, رزين","פיכח, פיכחת, מפוכח, להתפכח, פיכחים",y
drunk,y,y,y,y,y,y,y,y,y,"say, rượu, say_xỉn, xỉn, sỉn","酔, 酔っ払, 酔っぱら, 酔っ払い, 酔っぱらい","술, 취했, 취한, 취해서, 취하",y,y,y,y,y,y
sleepy,y,y,"νυστάζω, Νυστάζω, νυστάζεις, υπνηλία, νυστάζει",y,y,y,y,y,y,"buồn_ngủ, ngủ, girl, Buồn_ngủ, Ngái_ngủ","眠, 寝坊, 眠気, 寝ぼけ, 退屈","졸려, 잠, 졸리, 잠꾸러기, 아이바",y,y,y,y,"ישנוני, ישנונית, מנומנם, מנומנמת, רדום","नींद, आ, मिलता, रही, चाहता"
ready,"indulásra, Készülj, készülj, készek, Mehetünk","Valmistaudu, Valmistautukaa, lähtöön, Valmista, valmistautua","Ετοιμάσου, έτοιμες, Ετοιμαστείτε, Έτοιμη, έτοιμα","Готова, Готовы, Готов, готово, готова",y,"Prepárate, Lista, Listos, listas, preparados","Pronta, pronte, Pronti, preparando, Pronto","prêtes, Prêt, prêts, prête, préparer","準備, 非称, 准備, ready, 就緒",y,"準備, 用意, 覚悟, 整, 完了","준비, 됐, ready, 갈, 나요",y,y,"Hazırım, Hazırız, hazırsın, Gitmeye, hazırlan","جاهزه, مستعدّ, مستعدّة, جاهزا, مستعده","תתכונן, מוכנות, להתכונן, להכין, מוכנים",y
probable,"gyanúja, nyomós, megalapozott, Alapos, legvalószínűbb",y,y,"достаточные, вероятной, достаточного, достаточных, достаточное","Verdacht, möglichen, unwahrscheinlich, Wahrscheinlich, vermutlich",y,y,y,"理由, 合理, 正當, 充分, 可行","chính_đáng, có_lý_do, chứng, nghi, Nhiều","相当, 理由, 確実, グリーティング, 機影","근거, 상당, 성, 가능, CTE","น่าจะเป็นไปได้, ข้อเท็จจริง, ต้องมีมูลเหตุ, r, มีเหตุผล","kemungkinan, vs, Kemungkinan, penyebabnya, tertentu","Geçerli, Makul, Muhtemel, Olası, sebebimiz","محتملاً, مُحتمل, المحتملة, المُحتمل, محتملة","סבירה, סבירות, הסבירה, העילה, הסביר",n
private,y,y,y,y,y,y,y,y,y,y,"個人, プライベート, 私立, 民間, 探偵","개인, private, 사생활, 사설, 민간",y,y,"dedektifim, şahsi, mülk, görüşme, mesele","انفراد, إنفراد, خصوصية, خاصّ, خاصاً","פרטי, פרטיים, בפרטיות, פרטית, הפרטיים",y
public,"nyilvános, Nyilvános, kirendelt, közvélemény, nyilvánosság",y,y,"публике, общественности, публичное, общественном, общественность",y,"publico, públicas, públicos, pública, relaciones",y,y,y,y,y,"공개, 대중, 공공, 상장, 공립",y,y,"umumi, kamuya, Halka, halkla, Halkın","للعامة, العلن, الملأ, للجمهور, علني","ציבורי, בציבור, לציבור, הציבור, ציבורית","सार्वजनिक, जनता, and, आम, मैंसार्वजनिकरूपसेएकबूढ़े"
foreign,y,y,y,y,"ausländischen, ausländische, ausländischer, fremden, Ausländer","extranjeras, extranjera, extranjeros, exteriores, Exteriores",y,y,y,"nước_ngoài, ngoại, quốc, ngoại_giao, đối_ngoại",y,"외국, 외국인, 해외, 외국어, 물질",y,y,"Yabancı, yabancı, dışişleri, Dış, Dışişleri",y,"זר, זרה, זרות, הזרים, הזר",y
local,y,y,"τοπικό, τοπική, τοπικά, ντόπιος, ντόπια",y,"örtlichen, lokalen, lokale, örtliche, hiesigen",y,y,y,y,y,y,"지역, 현지, 동네, local, 주민",y,y,y,y,"מקומי, המקומי, מקומית, מקומיים, המקומית","स्थानीय, किसान, गुंडे, प्रतिष्ठित, इतीहास"
perfect,y,y,y,y,y,y,y,y,y,y,y,"완벽, 딱, perfect, 아주, 군요",y,y,y,"مثالية, المثالي, مثالياً, مثاليا, المثالية",y,"सही, एकदम, परिपूर्ण, आदर्श, ज़िंदगी"
bright,"bright, élénk, Fényes, fényesen, napos",y,y,y,y,y,y,y,y,"bright, tươi_sáng, chói, sáng_sủa, rực_rỡ","明る, 輝, 眩し, 光, まぶし","밝, bright, 똑똑, 긍정, 발랄",y,y,"Parlak, pırıl, aydınlık, ışıl, Zeki",y,y,"उज्ज्वल, समझदार, साफ़, ♪भ्रमउज्ज्वलथा, ♪लेकिनमेराहै"
dark,y,"pimeää, pimeässä, pimeä, synkkä, tumma","σκοτεινά, σκοτεινιάσει, σκοτεινός, νυχτώσει, σκούρο",y,y,y,y,y,y,"bóng_tối, tối, đen_tối, tối_tăm, tăm_tối","暗, 闇, 暗闇, ダーク, 暗黒","어두운, 어둠, 암흑, 어두워, 어둡",y,y,"karanlıktı, Karanlıktı, Karanlıkta, kararacak, Karanlıktan",y,y,y
black,"feketében, feketének, feketét, feketén, néger","mustana, mustissa, mustaksi, mustalla, mustista","μαύρος, μαύρων, μαύρους, μαύροι, μαύρης","чёрный, черный, чёрным, чёрное, чёрные",y,"negras, negra, negros, ojo, color",y,"black, noires, Noirs, Noir, noirs",y,"đen, da_màu, chợ_đen, da, màu","黒, ブラック, 黒人, ホール, 闇","흑인, 검, 블랙홀, 검정, 색",y,"hitam, black, berkulit, Hitam, berwarna","siyaha, siyahlar, siyahi, Zenci, zenci","سود, أسوداً, اسود, سوداء, الاسود","השחורות, בשחור, שחורות, השחורים, שחורה",y
white,"fehérben, fehéret, fehérek, fekete-fehér, White","valkoista, valkoisessa, valkonaama, valkoiseen, valkoviiniä","λευκού, άσπρη, λευκές, λευκά, λευκών","белая, белые, белых, белую, белым","weißen, weiße, weißer, weißes, Weißer",y,y,"blanches, Blancs, Blanc, blancs, Blanche",y,"trắng, da, bạch_cầu, màu, áo","白, 白人, ホワイト, ハウス, 亡者","백인, 하얀, 흰, 흰색, 화이트",y,y,"beyazdı, bembeyaz, beyazların, beyazı, beyazlar","بيضاء, البيضاء, الابيض, ابيض, بيض","בלבן, הלבנות, הלבנה, הלבנים, לבנה","सफेद, सफ़ेद, लडकी, कपडो, खीर"
red,"vöröset, pirosat, pirosra, vörösre, vörösbort",y,"κόκκινη, κόκκινες, κόκκινος, κόκκινου, κόκκινα","красный, красные, красное, красная, красной",y,"rojos, tinto, rojas, alfombra, Rojo",y,y,y,"đỏ, đèn_đỏ, màu, áo, tóc","赤, レッド, 赤毛, 真っ赤, 信号","빨간, 붉, 빨간색, 레드, red","สีแดง, แดง, ไฟแดง, พรม, หมวก",y,"kıpkırmızı, kırmızısı, kırmızıya, kızıl, ışıkta","حمراء, بالأحمر, احمر, الاحمر, الحمراء","האדומה, באדום, אדומים, אדומות, אדומה","लाल, गयी, लालिमा, जायेगी, काली"
orange,y,y,"πορτοκαλί, πορτοκαλιά, Πορτοκαλί, κίτρινο, πορτοκαλιού",y,y,"naranjos, Naranja, Orange, naranjas, refresco","arancione, arancioni, arancio, Orange, arance","oranger, Orange, oranges, soda, jaune",y,"cam, màu, màu_da_cam, da_cam, Màu",y,y,y,y,"turuncu, Turuncu, portakallı, portakalı, Orange",y,y,y
yellow,y,y,y,"желтый, желтые, жёлтый, желтая, желтой",y,y,y,y,"黃, 色, 独, yellow, 黄色","vàng, màu, Vàng, đèn_vàng, hèn_nhát","黄色, イエロー, 電光, トウモロコシ, 宿泊","노란, 노란색, 노랑, yellow, 노랗",y,"kuning, Kuning, yellow, pita, pengecut",y,y,y,y
green,y,y,y,"зеленый, зелёный, зеленые, зеленая, зеленой",y,y,y,y,y,"xanh, lá, màu, đèn_xanh, xanh_tươi",y,"녹색, 초록색, 초록, 녹차, green",y,y,y,"خضراء, الأخضر, الخضراء, أخضر, الاخضر",y,"हरे, हरी, हरियाली, लालच, हरा"
blue,y,y,y,"синий, голубой, синяя, синие, голубые",y,y,y,y,y,"xanh, màu, mắt_xanh, dương, blue","青, ブルー, 青色, 青空, 瞳","파란, 파란색, 푸른, 파랑, blue",y,y,"maviydi, maviyi, mavisi, masmavi, mavi","الأزرق, الزرقاء, زرقاء, أزرق, الازرق",y,y
purple,y,y,y,y,y,y,y,y,y,"tím, màu, chất, tía, Màu",y,"보라색, 액체, 조개, 드레스, 퍼플",y,y,y,y,y,"तुम्हारी, पर्पल, फ़्रेंड्स, मसलता, चूची"
pink,y,y,y,y,y,y,y,y,y,"hồng, màu, Màu, giấy, đỏ",y,"분홍색, 핑크, 색, 분홍, 붉",y,"pink, merah, muda, jambu, Pink",y,"الوردي, وردي, الوردية, وردية, الزهري",y,"बारबरा, पक्का, चाहती, है., झालरें"
brown,y,y,"καφετί, καφετιά, καστανό, καστανά, Καφέ",y,y,y,y,y,y,"nâu, màu, cú, da_màu, }","茶色, ブラウン, 茶, 褐色, cm","갈색, 흰색, 브라운, brown, 가죽",y,y,y,"البني, بنية, البنية, البنى, الأسمر","חום, חומים, חומה, חומות, החומים","भूरे, रंग, दूत, ब्राउन, बंद"
gray,y,y,y,y,y,y,y,y,y,"xám, màu, xám_xịt, bạc, gray",y,"회색, 흰머리, 늙, 색깔, gray",y,y,y,y,y,"झुर्रियों, भूरे, खिड़कियोंसेबाहरचली, एकठंडीग्रेधुंधजबमौतजुदाहुई, वजह"
golden,y,y,"χρυσή, χρυσά, χρυσές, Γκόλντεν, Χρυσό","золотой, золотые, золотая, золотым, золотое","goldenen, goldene, goldenes, goldener, Golden",y,y,y,y,y,y,"황금, 황금시대, 금, 금빛, 추억",y,y,y,y,y,"सोने, स्वर्ण, सुनहरा, सुनहरे, हूं"
silver,y,y,y,y,"Silber, silbernen, silberne, Silbertablett, silberner",y,y,"argenterie, argentée, argenté, Silver, plateau",y,y,y,"은색, silver, 은가락지, 희망, 냥",y,y,"gümüş, Gümüş, gümüşten, gümüşü, gümüşe",y,"מכסף, כסופה, כסוף, הכסוף, מגש",y
color,y,y,y,y,"Farbe, Haarfarbe, Augenfarbe, Hautfarbe, Farben",y,y,y,y,y,y,"색, 색깔, color, 피부색, 색상",y,y,"Rengi, Renk, renkti, Rengini, renge",y,y,y
I,"láttam, fogok, Szerintem, tudtam, magam","etten, Olin, olin, haluan, voin","μπορούσα, έκανα, Νομίζω, Ξέρω, είπα","люблю, понимаю, буду, хотел, тобой","dachte, glaube, leid, hätte, hatte","He, dije, Voy, Soy, Quiero","Voglio, devo, credo, dispiace, sto","aime, crois, pense, avais, étais","抱歉, 希望, I, 不想, 我會","xin_lỗi, Tớ, hiểu, Con, tớ","会, み, 自分, 必要, わか","미안, I, 모르, 줄, 는지","รู้สึก, ชอบ, ขอโทษ, จริงๆ, ชั้น","I, Kurasa, Maksudku, suka, padamu","seviyorum, Biliyorum, miyim, Bilmiyorum, ihtiyacım","أفعل, أظن, أني, أقول, أكون","ראיתי, רציתי, אוכל, אמרתי, אוהב","जानता, प्यार, देखा, जरूरत, मैंने"
you,"csinálsz, téged, Köszönöm, magát, veled","teidät, teille, voit, teitä, olette","Ευχαριστώ, ευχαριστώ, εσένα, είστε, πας","делаешь, Спасибо, можешь, Почему, тобой","Danke, kannst, willst, Warum, euch","contigo, Gracias, Estás, vas, has",y,"Merci, Comment, êtes, Pourquoi, où","you, 您, 謝謝, 幫, 見","ngươi, mày, gặp, nghe, Cậu","ありがとう, あんた, なぜ, どこ, 殺","널, 자네, you, 넌, 으면","รัก, ขอบคุณ, ไหน, ไง, แก",y,"Teşekkür, Teşekkürler, sizi, seninle, siz","شكرا, لكِ, منك, انك, معك","בך, ואתה, לכם, איתך, אוהב","तुमसे, धन्यवाद, तुमने, यदि, जानते"
he,"mondott, tud, mondja, hol, magát","halusi, sanoo, hänellä, Hänellä, kuollut","ήθελε, μπορούσε, ξέρει, πάει, λέει","говорит, знает, сделал, хочет, мог","sagt, sagte, wo, hätte, seine","hizo, quería, Él, sabe, dice","morto, avrebbe, sa, dice, aveva","S, sait, mort, veut, pense","he, 他會, 時, 殺, 可能","ổng, Hắn, Nó, vẫn, giết","男, どこ, 奴, そして, 自分","he, 자기, 어디, 다는, 살","ตอนที่, อาจจะ, ไหน, เค้า, บอกว่า","sebelum, Karena, ia, pikir, mana","dedi, etti, istiyor, Onun, nerede","يستطيع, يفعل, أنّه, قام, لكنه","כשהוא, עשה, מת, והוא, איפה",y
she,"mondott, lány, Hol, tud, nő","halusi, kertoi, tyttö, hänellä, nainen","εκείνη, ήθελε, μπορούσε, πει, ξέρει","могла, неё, говорит, нее, знает","sagt, ihre, sagte, wo, hätte","hizo, quería, dice, sabe, mujer","andata, Lei, avrebbe, aveva, vuole","fille, veut, pense, femme, ses","she, \ue6d5, 時, 喜歡, 又","cổ, Bà, chị, bé, bà","母, 女, 子, どこ, あの",y,"นาง, หล่อน, ตอนที่, อาจจะ, ชอบ","wanita, pikir, mana, ia, Apakah","Nerede, dedi, etti, kadın, Onun","أنّها, لأنها, بأنها, هى, لكنها","עשתה, כשהיא, מתה, הולכת, והיא",y
it,"rajta, róla, benne, túl, Talán","Anna, siinä, aika, sillä, siihen","αρέσει, γι, όπως, Να, ?","оно, этим, сделать, об, думаю","damit, wäre, machen, würde, tun","ello, hacerlo, creo, sea, Eso","farlo, fosse, Lo, L, così","est-ce, Oui, peut, juste, Ce","it, 喜歡, 碞, 真的, 可能","thật, Nó, lên, vậy, mọi","み, 考え, もの, （, ）","it, 그게, 봐, 그냥, 그래","ซะ, ชอบ, เอง, ใช้, หรอก","it, berhasil, melakukannya, benar, Apakah","şunu, Nasıl, İşte, bunun, olsun","عليها, بذلك, بها, يكن, سيكون","מזה, בזה, בו, וזה, לזה","इसे, इसके, बंद, होता, ऐसा"
we,"leszünk, tudunk, voltunk, megyünk, fogunk","tiedämme, olimme, voisimme, saamme, teemme","κάναμε, θέλουμε, Μπορούμε, είχαμε, ξέρουμε","сможем, знаем, будем, можем, вместе","brauchen, sollten, finden, unsere, waren","deberíamos, hacemos, debemos, Podemos, necesitamos","potremmo, sappiamo, dovremmo, facciamo, stiamo","sommes, ensemble, nos, avons, doit","we, 找到, 應該, 一起, 該",y,"一緒, 見つけ, 我々, 達, 必要","we, 우린, 얘기, 해야, 이제","ควร, เจอ, หา, ไง, โอเค","Sekarang, menemukan, pikir, mana, sampai","olduğumuzu, gidiyoruz, hepimiz, yapacağız, biliyoruz","بأننا, لكننا, اننا, نتحدث, نفعل","שאנו, שנוכל, ואנחנו, כולנו, נעשה",y
you,"csinálsz, téged, Köszönöm, magát, veled","teidät, teille, voit, teitä, olette","Ευχαριστώ, ευχαριστώ, εσένα, είστε, πας","делаешь, Спасибо, можешь, Почему, тобой","Danke, kannst, willst, Warum, euch","contigo, Gracias, Estás, vas, has",y,"Merci, Comment, êtes, Pourquoi, où","you, 您, 謝謝, 幫, 見","ngươi, mày, gặp, nghe, Cậu","ありがとう, あんた, なぜ, どこ, 殺","널, 자네, you, 넌, 으면","รัก, ขอบคุณ, ไหน, ไง, แก",y,"Teşekkür, Teşekkürler, sizi, seninle, siz","شكرا, لكِ, منك, انك, معك","בך, ואתה, לכם, איתך, אוהב","तुमसे, धन्यवाद, तुमने, यदि, जानते"
they,"tudnak, mondták, fogják, mondják, akarnak","heillä, olisivat, saavat, tekevät, tulevat","είπαν, έκαναν, ξέρουν, θέλουν, μπορούν","знают, хотят, говорят, сказали, могут","ihnen, kommen, ihre, waren, wollen","dicen, saben, quieren, hacen, estaban","dicono, vogliono, possono, siano, fanno","veulent, peuvent, font, elles, S","they, m, 它們, l, 那些","Chúng, Họ, bọn, nhau, giết","奴, どこ, そして, もの, 殺","they, 놈, 어디, 애, 다는","อาจจะ, บอกว่า, เค้า, เด็ก, ไหน","menemukan, pikir, mana, ketika, mengatakan","istiyorlar, söylediler, olduklarını, bunlar, onların","بأنهم, لكنهم, لأنهم, وهم, يقولون","שהן, כשהם, עשו, אמרו, אומרים",y
this,"erről, reggel, ennek, ezen, ebben","tänä, tällä, kertaa, tähän, Tässä","πρωί, αυτήν, σήμερα, αυτόν, μέρος","эта, эту, этой, этим, вот",y,"Esto, Mira, mañana, lugar, tipo","quest, farlo, Questo, posto, modo","cela, cet, fois, peut, est-ce","this, 這次, l, 這種, 地方","nay, vụ, Đây, Chúng_ta, không_thể","こう, こんな, 男, ため, 前","this, 이걸, 이번, 이거, 이게","อย่างนี้, แบบนี้, ทั้งหมด, เกี่ยวกับ, ฟัง","pagi, kali, dunia, rumah, Apakah","sefer, burası, Buna, şunu, sabah","الصباح, المرة, بهذه, وهذا, هكذا","הבוקר, הפעם, המקום, ככה, הזו",y
that,"ezért, Ezt, igaz, tudja, arra","tuota, tuon, Tuo, noin, siinä","αυτός, είπε, γι, ξέρεις, σ","тот, эту, этим, которые, вот","dieser, Ist, diese, wissen, würde","Eso, creo, hecho, esa, cosas","Lo, quel, così, quella, cose","est-ce, jamais, quoi, Ce, avoir",y,"vậy, không_thể, rằng, chưa, chứ","そんな, あの, 考え, もの, わか","that, 그렇게, 그건, 그게, 그런","อย่างนั้น, แบบนั้น, บอกว่า, สามารถ, น่ะ","berpikir, benar, Apakah, Bagaimana, mengatakan","Öyle, Bunun, bunun, söyledi, demek","وهذا, هكذا, يعني, بذلك, بهذا","ש, ככה, כזה, וזה, הזאת","उस, ऐसा, मतलब, जानते, वो"
here,"keresel, gyere, folyik, jöttem, Gyere","Tulin, Täällä, tule, Tule, täältä","εδω, ήρθα, έλα, φύγουμε, Εδώ","Иди, Здесь, отсюда, делаешь, сюда","hierher, her, machst, Hier, Komm","acá, aqui, ven, Ven, venido","Qui, Vieni, qua, venuto, venire","Viens, venu, venir, rester, Que","here, 這兒, 這里, 過來, \ue2c9","Lại, Ở, đưa, ngay, khỏi","こっち, 来る, ここ, 居, なぜ",y,"มานี่, ตรงนี้, ทาง, รอ, พา","Kemarilah, kesini, kemari, Di, disini","buradayız, buradasın, Buradaki, buradaki, burda","تعالي, هُنا, تعال, ها, المكان","לפה, באתי, מפה, בואי, להישאר",y
there,"odakint, onnan, Ott, oda, több","tuonne, Tuolla, paikalla, olemassa, sieltä","Εκεί, υπήρχε, πέρα, υπάρχουν, Υπάρχει","Там, Есть, туда, много, один","Gibt, drüben, drin, draußen, gab",y,y,"là-bas, quelqu, étais, toujours, quelque","there, 那里, 那兒, 那邊, 那裡","dưới, kia, ngoài, ngay, vẫn","あそこ, そこ, 居, すぐ, 他",y,y,"kesana, disana, luar, Di, atas","Oraya, oradan, Orada, oraya, varsa","وهناك, هُناك, بالخارج, هنالك, يوجد","משם, ויש, למטה, שאין, בחוץ","वहाँ, वहां, वहीं, होना, देखो"
who,"kivel, kit, kinek, kik, Aki","keitä, ketä, kenen, tappoi, jolla","ποιός, οποίος, ποιον, ποια, ποιος","кому, кем, которого, кого, человека",y,"único, Quién, hizo, quien, personas","quelli, Chi, donna, sa, sapere","celui, ceux, Qui, sait, femme","who, 街, 男人, 女人, \ue01d","Ai, duy_nhất, Người, kẻ, xem","犯人, 人間, 見つけ, 男, 奴",y,"ผู้, คนเดียว, ผู้ชาย, ซึ่ง, ผู้หญิง","satu-satunya, Orang, dirimu, sebenarnya, Siapa","Kimin, bilen, isteyen, çalışan, yapan","مَن, ومن, الذى, يريد, قتل","ומי, למי, שיכול, אשר, האיש",y
what,"miről, mondott, folyik, jelent, mire","mihin, teemme, kyse, tarkoittaa, teen","τί, ποιο, έκανες, συνέβη, έγινε","чём, произошло, именно, происходит, чего","Weißt, getan, genau, los, weißt","cuál, haces, pasó, importa, pasa","ciò, succede, cos, cio, So",y,"what, 怎樣, 到底, 辦, 所","thế_nào, xảy, hiểu, xem, Đó","どんな, 起き, 意味, 起こ, 教え","what, 뭔지, 인지, 뭘, 어떤","เรื่องอะไร, หมายถึง, บ้าง, เกี่ยวกับ, เกิด","itulah, Itulah, kulakukan, dilakukan, inginkan","Neyi, neyin, Biliyor, istediğini, Neler","وماذا, وما, يجري, تفعله, أتعلم","במה, ממה, ומה, שקרה, מושג","किस, बताओ, यही, कहते, कारण"
where,"ahonnan, ahová, merre, Hova, Hová","menet, minne, Mihin, Minne, Siellä","Εκεί, βρίσκεται, σημείο, πήγε, Εδώ",y,"wohin, Ort, hin, dort, Hier","adónde, Ahí, Aquí, Dónde, dónde","trova, dov, Dov, andando, Dove","trouve, endroit, sait, Où, trouver","where, 哪里, 哪裡, 哪兒, \ue177","nơi, chỗ, Đây, xem, đưa",y,y,y,"darimana, kemana, berasal, dimana, Dimana","neredesin, nerde, Nereden, gittiğini, yerden","وأين, ذاهب, اين, نعرف, تذهب","ואיפה, מאיפה, שבה, למקום, היכן",y
when,"először, éves, Majd, Mikor, voltál","milloin, Milloin, Silloin, Muistatko, olit","πότε, ήσουν, μόλις, ήμουν, Όταν","пор, тогда, после, всегда, лет",y,y,"mentre, ero, Quando, visto, siamo","sera, Quand, alors, ans, avais",y,"Khi, nhớ, nhìn, lúc, lần",y,y,"เมื่อไหร่, ตอนที่, ตอน, ตั้งแต่, พอ",y,"yaşındayken, zamandan, olduğunda, hatırlıyor, geldiğinde",y,"כשזה, כשאת, כשהם, כשהיא, כשהייתי",y
how,"meddig, mennyit, hány, mennyi, honnan","miltä, toimii, monta, kuuluu, Tiedät","πόσα, Πόσο, Πως, καιρό, πόσο","откуда, насколько, долго, дела, сколько","viele, lange, So, weißt, soll","cuántos, cuánto, importa, tal, Sé","quante, quanti, com, So, sa",y,y,y,"どれ, どの, くらい, 方法, どんな",y,y,"seberapa, caranya, betapa, belajar, berapa","nasılsın, Kaç, dersin, gidiyor, nereden","وكيف, كيفية, حالك, مدى, عدد","ואיך, שלומך, כיצד, מושג, משנה",y
