picture,y,y,y,"картинка, фотку, фотография, картинку, сфотографировать","Bild, Foto, vorstellen, Film, gemacht",y,y,y,"照片, picture, 拍照, 張照, 酚","ảnh, hình, bức, chụp, tranh",y,y,"รูป, ถ่ายรูป, ภาพ, รูปนี้, รูปนั้น",y,"Resmini, resmimi, resimde, fotoğrafımı, resme","صورتها, الصوره, صورتي, صورتك, صوره","מהתמונה, להצטלם, לתמונה, בתמונה, תמונת",y
frame,y,y,y,"подставить, кадр, рамку, раму, кадром","Rahmen, anzuhängen, anhängen, Zeitrahmen, Bilderrahmen",y,y,y,y,y,y,y,y,y,y,y,"להפליל, מסגרת, המסגרת, למסגרת, פריים",y
photograph,y,"valokuva, valokuvan, valokuvaa, valokuvasta, Valokuva",y,y,"Foto, fotografieren, Fotografie, fotografiert, Fotos",y,y,y,y,"ảnh, chụp, hình, bức, tấm",y,y,y,y,"fotoğrafa, Fotoğrafı, Fotoğrafta, Fotoğraftaki, fotoğraftaki","فوتوغرافية, لتصوير, الصوره, صورتها, صورتك","תצלום, התצלום, בתצלום, צולמה, הצילום","प्रसारित, यूनिवर्सिटी, फ़ोटो, तस्वीर, क्\u200dया"
map,y,y,y,y,"Karte, Landkarte, Schatzkarte, Plan, Auf",y,"mappa, cartina, mappe, carta, tesoro",y,y,y,y,y,y,y,y,y,"המפה, במפה, מפת, מהמפה, למפה","नक्शा, नक्शे, मानचित्र, दें, लगाना"
list,y,y,y,y,"Liste, Gästeliste, aller, oben, stehen",y,y,y,"名單, 清單, 單上, 名, 單",y,y,y,y,y,y,"القائمة, قائمتي, قائمتك, اللائحة, القائمه",y,y
table,"asztalról, asztalunk, műtőasztalon, asztaltól, asztalt",y,y,y,"Tisch, sitzt, sitzen, Auf, Essen",y,y,"table, mettre, sous, ta, notre","桌子, 桌上, \ue1b7, 餐桌, 餐桌上",y,y,y,y,y,"Masayı, Masaya, masayı, Masada, masadan",y,y,y
chart,"kórlapját, kórlapot, ülésrendet, táblázatot, táblázat",y,y,"карту, карте, таблицу, схему, диаграмму",y,"gráfico, gráfica, diagrama, trazar, ficha",y,"graphique, diagramme, thème, tableau, fiche",y,y,"チャート, 図, カルテ, 表, 座席","차트, 써, 표, 기록, 환자",y,y,y,y,"הגיליון, תרשים, התרשים, בגיליון, הישיבה",y
calendar,"naptár, naptárat, naptárban, naptáram, naptára","kalenterin, kalenteria, kalenteriin, kalenterista, Kalenteri",y,y,"Kalender, Terminkalender, Termine, Tage, seinem",y,y,y,y,y,y,y,y,y,y,y,"לוח, בלוח, ביומן, היומן, ללוח","कैलेंडर, चिन्हित, देता, तुम्हारा, खैर"
schedule,"menetrend, menetrendet, beosztást, ütemtervet, beosztását","aikataulussa, aikataulu, aikataulun, aikataulusta, aikataulua",y,y,"Zeitplan, Terminplan, Termine, Stundenplan, Terminkalender",y,"tabella, agenda, orari, impegni, turni",y,y,y,y,y,y,y,"programımı, Programa, programım, Programımı, gerisindeyiz",y,"הזמנים, לוח, בלוח, זמנים, ללוח",y
compass,y,y,y,y,"Kompass, Zirkel, moralischer, zeigt, Norden",y,y,y,"指南, 針, 盤, 羅, 皐",y,"コンパス, ３１, 羅針, 盤, ０",y,y,y,y,y,y,y
ruler,y,"hallitsija, hallitsijan, hallitsijaa, hallitsijana, viivoittimella","χάρακα, ηγεμόνας, κυρίαρχος, χάρακας, ηγεμόνα",y,"Herrscher, Herrscherin, Herrschers, Landes, Kaiser",y,"sovrano, sovrana, regnante, dominatore, governante",y,y,"cai_trị, thước_kẻ, trị_vì, thước, cầm_quyền","支配, 者, 統治, 正当, 定規","통치자, 지배자, 지도자, 신하, 따를",y,y,y,y,y,y
toy,y,"lelu, lelun, lelua, lelusi, leikkikalu","παιχνιδιών, παιχνιδάκι, παιχνιδάδικο, παιδικό, παιχνίδια",y,"Spielzeug, Spielzeugladen, Lieblingsspielzeug, neues, kleines",y,y,y,y,y,y,y,y,y,y,"لعبتك, الالعاب, بلعبة, لعبتي, لعبه","צעצוע, הצעצוע, הצעצועים, צעצועים, לצעצוע",y
clock,"ketyeg, Ketyeg, órás, hajnali, órára","tikittää, kellon, kelloa, Kahdeksalta, kahdelta",y,y,"tickt, rund, Wecker, morgens, läuft",y,y,"horloge, pendule, réveil, tourne, montre",y,"đồng_hồ, Đồng_hồ, Hướng, điểm, 00",y,y,y,"jamnya, berdetak, clock, Waktu, Pukul","Saati, işliyor, Saatin, saatin, saate","تدق, عقارب, مدار, السّاعة, الواحدة","השעון, מתקתק, לשעון, בשעון, שעון","घड़ी, रीसेट, घड़ी, आवाज़, tickin"
lamp,y,"lamppu, lampun, lamppua, Lamppu, lampusta",y,"лампу, лампа, лампы, лампой, Лампа","Lampe, Laterne, Öllampe, kaputt, Fenster",y,y,y,y,"đèn, cây, Đèn, đèn_đỏ, nhắm",y,y,y,y,y,y,y,"दीपक, चिराग़, जलाओगी, शान्ति, मिलेगी"
fan,"ventilátor, ventillátor, ventillátort, szurkoló, rajong","fani, ihailija, tuuletin, ihailijasi, tuulettimen",y,y,"Fan, Ventilator, Fächer, Fanpost, Kacke",y,"ventilatore, ventaglio, tifoso, ventola, ammiratrice",y,y,"fan, hâm_mộ, quạt, cuồng, Fan",y,y,y,y,y,"مروحة, المروحة, معجبي, نصير, مشجعي",y,y
camera,y,"kamera, kameran, kameraa, Kamera, kameraan","κάμερα, φωτογραφική, κάμερά, Κάμερα, μηχανή",y,"Kamera, Kameras, Eine, deine, wurde",y,y,"caméra, camera, appareil, vidéo, surveillance",y,y,y,y,y,y,"kamerayı, Kamerayı, Kameraya, Kamera, kameraya",y,"המצלמה, מצלמה, למצלמה, במצלמה, שהמצלמה",y
telephone,"telefonnal, telefonos, Telefon, Telefonon, telefonhoz","puhelimitse, puhelimella, puhelinta, Puhelu, puhelinnumero","τηλεφωνο, τηλεφωνική, τηλεφωνικές, τηλεφωνικό, θάλαμο","телефонной, телефоном, телефонный, телефонные, Телефон","telefoniert, telefonieren, Telefonnummer, Telefon, ans","telefonear, poste, telefónico, telefono, telefónicas","palo, telefoniche, telefonico, telefonare, telefonica","poteau, téléphonique, téléphoner, téléphoniques, cabine",y,y,y,y,y,y,"direğine, Telefonunuz, Telefonunuzu, telefonunuz, Telefonla","التليفون, تليفون, بالهاتف, الهاتفية, هاتفية","לטלפן, הטלפונים, עמוד, טלפונים, לטלפון",y
television,y,"televisio, television, Televisio, televisioon, televisiosta",y,y,y,y,y,y,y,y,y,y,y,y,"Televizyona, Televizyonun, televizyondan, televizyonun, televizyonu","التليفزيون, للتلفزيون, للتلفاز, التلفزيونِ, شاشات","לטלוויזיה, בטלביזיה, הטלויזיה, טלויזיה, בטלויזיה","टेलीविजन, टीवी, तनावपूर्ण, उद्घोषक, शूटिंग"
computer,"számítógép, számítógépen, gépén, gépét, gépem","tietokone, tietokoneen, tietokonetta, tietokoneella, tietokoneelle",y,"компьютер, компьютере, компьютера, компьютером, компьютеру","Computer, seinem, seinen, deinen, meinem",y,y,"ordinateur, données, accès, cet, trouvé",y,"máy_tính, vi_tính, Máy_tính, mạng, máy",y,y,y,y,"bilgisayarı, Bilgisayarı, Bilgisayarın, Bilgisayara, bilgisayarını",y,"המחשב, מחשב, במחשב, למחשב, מהמחשב",y
laptop,"laptopot, laptopja, laptopom, laptopon, laptopomat",n,"φορητό, υπολογιστής, υπολογιστή, πρόσβαση, αρχεία",n,n,n,"portatile, PC, computer, file, rubato","ordinateur, PC, portable, volé, cet","電腦, 筆記本, 手提, 記本, 掸癘","laptop, máy_tính, xách, Laptop, tải",y,y,y,y,"dizüstü, bilgisayarı, bilgisayarını, Bilgisayarı, bilgisayarın",n,"הנייד, נייד, הנישא, לפטופ, והמחשב",y
program,y,"ohjelma, Ohjelma, ohjelmaan, ohjelman, ohjelmasta",y,y,"Programm, Programms, Sendung, Computer, unser",y,y,y,y,y,y,y,y,y,y,y,"לתכנת, התוכנה, מתוכנית, תוכנה, לתכנית",y
network,"hálózat, hálózati, hálózata, hálózatát, hálózatba","verkosto, verkoston, verkkoon, verkon, verkko",y,y,"Netzwerk, Sender, Network, Netz, unser",y,y,y,y,y,"ネットワーク, 網, ネット, 接続, 繋が","네트워크, 접속, 방송국, 조직, 망",y,y,y,"شبكة, الشبكة, للشبكة, الشبكه, بالشبكة","הרשת, רשת, לרשת, מהרשת, ברשת","नेटवर्क, संपर्कों, दांत, -34, कार्बनिक"
refrigerator,"hűtő, hűtőben, hűtőt, hűtőszekrény, hűtőbe","jääkaapin, jääkaappi, jääkaapissa, jääkaappiin, jääkaapista",y,y,"Kühlschrank, Eisschrank, Im, Essen, meinem",y,y,y,y,y,"庫, 冷蔵, 水漏れ, 掃除, 冷凍",y,y,y,y,y,"המקרר, במקרר, מקרר, למקרר, מהמקרר","रेफ़्रीज़रेटर, प्\u200dयार, मेरा, वास्\u200dतव, फ़रीद"
air conditioner,n,n,n,n,n,n,n,n,n,n,n,n,n,n,n,n,n,n
washing machine,n,n,n,n,n,n,n,n,n,n,n,n,n,n,n,n,n,n
vacuum cleaner,n,n,n,n,n,n,n,n,n,n,n,n,n,n,n,n,n,n
oven,"sütőben, sütőbe, sütő, sütőt, sütőből","uunissa, uuniin, uunin, uuni, uunista",y,"духовке, духовку, духовки, печь, печи","Ofen, Backofen, Braten, Röhre, Herd",y,y,y,y,y,y,y,y,y,y,y,"בתנור, התנור, תנור, לתנור, מהתנור",y
kettle,"kannát, teavíz, teáskanna, teafőzőt, Felforrt","kiehumaan, soimaa, kattilaa, kattila, Pata",y,y,"Kessel, Wasserkocher, Teekessel, Popcorn, Teewasser",y,y,y,"水壺, 燒水, 爆米花, 水燒, 水泡","ấm, nước, chê, lông, mèo","やかん, ヤカン, 茶, 火, ぐらい",y,y,y,"ısıtıcısını, çaydanlığı, Çaydanlık, Çaydanlığı, ısıtıcıyı",y,"הקומקום, קומקום, נחושת, בקומקום, תרתיח",y
microwave,n,"mikro, Lämmitän, metallia, lämmittää, panna",n,n,"Popcorn, ne, neue, Eine, In",n,y,n,"微波, 爐, 爆米花, 稬, 猧","vi_sóng, lò, ngô, bỏng, nướng","レンジ, 電子, マイクロ, 波, 放射","전자레인지, 렌지, 전자, microwave, ovens",y,y,"fırın, mikro, fırını, Mikro, fırının",y,y,"बीलकुल, microwave, ऐसे, जैसे, मेरा"
razor,y,"partaveitsi, partaveitsellä, partaterä, partateriä, partaveistä",y,y,"Rasiermesser, Rasierer, Rasierklinge, Rasierklingen, Rasierapparat","navaja, afeitar, cuchilla, maquinilla, cuchillas",y,y,y,y,y,y,y,"cukur, silet, razor, cukurnya, Occam",y,"الحلاقة, حلاقة, موس, شفرات, بموس","גילוח, הגילוח, תער, סכיני, התער",y
radio,"rádiót, rádió, rádióban, rádión, rádiós","radio, radion, radiota, radiossa, radiosta",y,y,"Radio, Funkgerät, Funk, Radiosender, Funkkontakt",y,y,y,"收音, 無線電, 無線, 廣播, 電台",y,y,y,y,y,y,"الراديو, المذياع, راديو, اللاسلكي, الإذاعة","הרדיו, רדיו, ברדיו, לרדיו, אלחוט",y
chip,"zsetont, zseton, chipset, chips, alku",y,"πατατάκι, μάρκα, Τσιπ, πατατάκια, εντοπισμού","козырь, жетон, чипсов, фишку, чипсы","Chip, Druckmittel, Chips, vom, diesen","ficha, Chip, patata, astilla, menta","chip, patatina, gettone, fiche, Chip","puce, jeton, chips, monnaie, pépites",y,y,y,y,y,y,"cipsi, kozu, fiş, Chip, fişi",y,"שבב, מיקוח, לשבב, אסימון, שהשבב",y
screen,y,"Näytölle, ruudulla, näytölle, näytöllä, valkokankaalla",y,y,"Bildschirm, Schirm, Leinwand, Probeaufnahmen, Monitor",y,y,y,y,y,y,y,y,y,y,y,"המסך, מסך, במסך, רעלים, למסך",y
keyboard,"billentyűk, billentyűket, billentyű, zongorát, gomb","koskettimet, raukkamaisesti, näyttö, Näpit, pannut","πλήκτρα, αρμόνιο, κλαβιέ, Κλικ, οθόνη","клавиши, клавишах, играл, играть, компьютером","Tasten, Klavier, Computer, Finger, deiner",y,y,y,y,y,y,"키보드, keyboard, 컴퓨터, Taps, 꼬꾸라져",y,"keyboard, Keyboard, mengetik, ketik, melekat","org, tuş, bilgisayarın, Bilgisayar, çalmaya","لوحة, بلوحة, للوحة, لوح, الغيتار",y,"-, हताश, \u200b\u200bउच्छ्वास, कीबोर्ड, क्लिक"
scanner,"CT-t, CT, rádión, radar, Rendőrségi","skannerin, poliisiradiota, Skannerin, skannerit, skannata","σαρωτή, σκάνερ, σαρωτής, ανιχνευτή, ανιχνευτής",y,"Polizeifunk, Funk, außerhalb, zeigt, hörte",n,"retina, lettore, frequenze, sullo, impronte",y,"掃, 瞄儀, 瞄器, 描器, 苯",y,y,y,"สแกน, เครื่อง, สแกนเนอร์, แสกน, ซีทีสแกน",y,y,"الماسح, الضوئي, ماسح, ضوئي, الفاحص","סורק, הסורק, בסורק, לסורק, רשתית",n
printer,y,"painaja, painoon, painossa, muste, mustetta","εκτυπωτή, τυπογράφος, τυπογράφο, τυπογραφείο, εκτύπωση","принтера, печатника, типографии, чернила, печати","Drucker, Druckerei, Druck, Papier, Computer","impresor, imprenta, tipógrafo, impresoras, imprimir",y,y,"打印, 機, 印刷, 3D, 廠",y,y,"프린터, D, 3, , ",y,y,y,y,"הדפוס, המדפיס, התלת, תלת, הדיו",n
earphone,n,"pistokkeen, vastaanotti, 03, Katolla, Hänellähän",y,n,"Kopfhörer, Knopf, geraspelten, dirigiere, Befestigen",n,n,n,y,y,"*, イヤホン,  earphone, heads , dirty necks",n,n,y,n,n,n,n
microphone,y,"mikrofoni, mikrofonin, mikrofoniin, mikrofonia, Mikrofoni",y,y,"Mikrofon, Mikro, Mikrophon, Mikrofone, singen",y,y,y,y,"micro, microphone, mic, bật, âm","マイク, 盗聴, オン, 器, 全","마이크, 어딨, 잠시, 꼈었, 헤드폰",y,y,y,y,"המיקרופון, מיקרופון, למיקרופון, במיקרופון, מהמיקרופון",y
loudspeaker,y,"kaiutin, kaiuttimen, kovaäänisen, kuulutettiin, kaiuttimista",y,y,"Lautsprecher, Lautsprechern, Lautsprechersystem, ausrufen, Durchsage","altavoz, altavoces, megáfono, parlante, megafonía",y,y,"喇叭, 按, 擴音器, 廣播, 流速",y,y,n,n,"loudspeaker, pengeras, Man, melantunkan, Perempuan",y,"مكبر, الصوت, مكبرات, صوتٍ, المكبر","רמקול, ברמקול, הרמקול, במיקרופון, הכריזה",n
instrument,y,"väline, instrumentti, soitinta, instrumenttia, välikappale",y,y,"Instrument, Werkzeug, stumpfen, Gegenstand, Musikinstrument",y,y,y,y,y,y,y,y,y,"enstrüman, enstrümanı, aletle, Enstrüman, çalgı",y,"הכלי, נגינה, קהה, בכלי, הנגינה","साधन, फटकार, प्रतिनिधित्व, संस्था, इसलिए"
concert,y,"konserttiin, konsertti, konsertin, konsertissa, konsertista",y,y,"Konzert, Karten, beim, morgen, geben",y,y,y,y,"buổi, hòa_nhạc, hoà_nhạc, biểu_diễn, trình_diễn",y,y,y,y,y,"الموسيقية, الحفل, الموسيقيةِ, موسيقية, موسيقي","קונצרט, הקונצרט, לקונצרט, בקונצרט, בהופעה",y
opera,y,"oopperaan, oopperassa, oopperaa, oopperasta, ooppera","όπερα, όπερας, Όπερα, οπερα, όπερά",y,"Oper, Opern, Opernhaus, Opernsängerin, Seifenoper",y,"opera, Opera, lirica, teatro, soap",y,y,y,y,y,y,y,y,y,"אופרה, האופרה, לאופרה, באופרה, מהאופרה","ओपेरा., ध्वनि, बना, रही, जाता"
orchestra,y,"orkesteri, orkesterin, orkesteria, orkesterissa, Orkesteri",y,y,"Orchester, Orchesters, Orchestergraben, Dirigent, Orchestra",y,y,y,y,y,y,y,"วง, ออ, เคสต, ออเคสตร้า, ร้า",y,y,y,"התזמורת, תזמורת, בתזמורת, לתזמורת, מהתזמורת",n
symphony,y,"sinfoniaa, sinfonian, sinfoniaan, sinfoniani, sinfoniasta","συμφωνική, Συμφωνική, Συμφωνία, συμφωνικής, Μπετόβεν",y,"Symphonie, Sinfonie, Symphonieorchester, Symphoniker, Sinfonieorchester",y,y,y,y,"giao_hưởng, bản, than_khóc, bản_nhạc, thổi","オーケストラ, シンフォニー, 交響, コンサート, 曲",y,y,y,y,y,"סימפוניה, הסימפוניה, לסימפוניה, הסימפונית, בסימפוניה",n
melody,"dallam, dallamot, melódia, dallama, Melody","melodia, melodian, melodiaa, Melodia, sävel",y,y,"Melodie, Melodien, Sanfte, Ton, ♪",y,y,y,y,y,y,y,y,y,y,y,"מנגינה, המנגינה, הלחן, מלודיה, מלודי",y
rhythm,y,"rytmi, rytmin, rytmiä, Rytmi, rytmitajua",y,y,"Rhythmus, rhythm, Takt, Trommel, Herzschlag",y,y,y,y,y,y,"리듬, rhythm, 리듬감, 규칙, 잡혔",y,y,y,"الإيقاع, إيقاع, الايقاع, ايقاع, بالإيقاع","קצב, הקצב, לקצב, סינוס, מקצב",y
rhyme,y,"rimmaa, riimi, riimin, riimejä, riimit","ρίμα, ομοιοκαταληξία, ρίμες, τραγουδάκι, στιχάκι",y,"Reim, reimt, reimen, Kinderreim, Reimen",y,y,y,"押韻, 一首, 搖滾, 童謠, 韻律","vần, điệu, Bài, thơ, vần_thơ",y,"아름다운, 옛, 노래, 이야기, 동요",y,y,y,y,y,n
lyrics,"dalszöveg, szöveget, dalszöveget, szöveg, szövegét","sanat, Sanat, sanoitusta, sanoissa, sanoista",y,"текст, тексты, лирика, лирику, текстом","Text, Texte, Melodie, Songs, geschrieben",y,y,"paroles, textes, texte, écris, chanter",y,"lời, bài, Lời, nhạc, Châu_Phi",y,y,y,y,"sözleri, sözlerini, Sözleri, Sözler, Sözlerini",y,"המילים, מילות, שהמילים, למילים, מהמילים",n
classical music,n,n,n,n,n,n,n,n,n,n,n,n,n,n,n,n,n,n
pop music,n,n,n,n,n,n,n,n,n,n,n,n,n,n,n,n,n,n
jazz,y,"jazzia, jazzista, jazz, jazzin, jatsia",y,y,"Jazz, Jazzmusiker, Jazzband, Magst, ♪",y,y,y,"爵士, 樂, 演奏, 樂手, \ue60e",y,y,y,y,y,y,"الجاز, جاز, للجاز, بالجاز, لموسيقى","ז, נגני, ההתלהבות, בלוז, הג",y
blues,y,"bluesia, blues, Blues, sinisiä, murheet","μπλουζ, μπλούζ, blues, μελαγχολία, Μπλουζ","блюза, Блюз, блюзы, хандру, Домашний",y,y,y,y,y,y,y,y,"เพลงบลู, ส์, blues, บลู, ส์.",y,"blues, Blues, Hüzünlü, hüzün, duyabilirsiniz",y,y,y
punk,y,"nilkki, retku, nulikka, nilkin, roisto","αλήτη, αλήτης, ρεμάλι, αλητάκο, Αλήτη",y,"Penner, Dreckskerl, Wichser, Arschloch, kleiner","gamberro, vándalo, rufián, mocoso, patán","teppista, teppistello, delinquente, moccioso, stronzetto","voyou, crapule, vaurien, minable, connard",y,"rác_rưởi, vô_dụng, nhãi, lưu_manh, du_côn",y,y,"พังก์, ไอ้บ้า, ค์, พัง, ไอ้เวร",y,y,y,"פרחח, פאנק, הפרחח, פושטק, לפרחח","गुंडा, पहना, बदमाश, Hook, युवा"
rock,"szikla, sziklán, sziklát, kővel, punk","kivi, kivellä, kallio, kiveen, kiven",y,"камень, скала, скале, камнем, скалу","Felsen, Fels, Stein, rocken, rock",y,y,y,y,y,y,y,y,y,y,"صخرة, الصخرة, الصخر, صخور, rock",y,y
horn,"kürt, dudát, szarv, duda, kürtöt","torvea, torvi, sarvi, torven, torveen",y,y,"Horn, Hupe, hupen, hupt, Hupen",y,y,y,y,y,y,y,y,y,y,y,y,y
trumpet,y,"trumpettia, trumpetti, trumpetin, trumpetisti, Trumpetti",y,y,"Trompete, Trompeter, Posaune, Trompeten, big",y,y,y,y,y,y,y,y,y,y,y,"החצוצרה, חצוצרה, בחצוצרה, חצוצרת, חצוצרן",n
saxofone,n,n,n,n,n,n,n,n,n,n,n,n,n,n,n,n,n,n
tuba,y,"tuubaa, tuba, tuubansoittajia, Laiha, Pianisteja",y,"тубе, They, down, цыпочкой, лёгким","Tuba, Tubaspieler, Blaskapelle, Lunge, Über",y,y,y,y,y,"ダジャレ, ラッパ, 相応, ッ, ハマ",n,y,y,y,"البوق, بوق, توبا, الأبواق, بوقًا","בטובה, אקורדיון, -טובה, המובילה, טרומבון",n
drum,y,"rumpu, rumpua, rummun, rummut, rumpuja",y,y,y,y,"tamburo, batteria, tamburi, grancassa, assolo","tambour, batterie, baril, tambours, Battez",y,"trống, rum, rộn_rã, pa, nhịp",y,y,y,y,y,y,"תוף, התוף, תופים, בתוף, התופים","ड्रम, धड़कता, तेज़, दुर्लभ, टाईट"
guitar,y,"kitaraa, kitara, kitaran, kitarani, kitarasi",y,y,"Gitarre, spielte, spielst, spiele, gespielt",y,y,y,y,"guitar, đàn, ghita, cây, ghi",y,y,y,y,y,y,"הגיטרה, גיטרה, בגיטרה, לגיטרה, גיטרת",y
cello,y,y,y,y,"Cello, spielst, spiele, gespielt, spielt",y,y,y,y,"cello, đàn, đại_vĩ, cầm, cây",y,y,y,"cello, cello-ku, cello-nya, bergetar, biola",y,y,"הצ, בצ, והצ, שהצ, לצ",n
violin,y,"viulua, viulu, viulun, Viulu, viulunsa",y,y,"Geige, Violine, Geigenkasten, spielte, spiele",y,y,y,y,"cầm, cây_vĩ, violin, vĩ, đàn",y,y,y,y,y,y,y,n
piano,y,"pianoa, pianon, piano, Piano, pianolla",y,y,"Klavier, Piano, Klavierspielen, Flügel, Klavierunterricht",y,y,y,y,"piano, đàn, dương_cầm, Piano, cây",y,y,y,y,y,y,"הפסנתר, פסנתר, בפסנתר, לפסנתר, הפסנתרן",y
organ,y,"elin, elimen, elinten, urkuja, urut",y,y,"Organ, Orgel, Organe, Orgelmusik, spielt","órgano, órganos, donante, donación, trasplante",y,y,y,"tạng, nội, cơ_quan, hiến, bộ_phận",y,"장기, 기관, 기증, 기증자, 이식",y,y,y,"العضو, بالأعضاء, الأعضاء, متبرع, الاعضاء","איברים, איבר, האיבר, האורגן, תרומת",y
string,"madzag, madzagot, zsinór, zsinórt, húrt","narua, naru, narun, narusta, narulla","χορδή, σπάγκο, κορδόνι, εγχόρδων, κουαρτέτο","струн, квартет, струна, струну, струнный","Schnur, Faden, String, aufhängen, Kette","cordel, cuarteto, cordón, Cuerdas, hilo",y,"ficelle, string, cordes, pendre, ficelles",y,y,"弦, 糸, 一連, 列, ヒモ",y,y,"string, benang, senar, rentetan, serangkaian","yaylı, ipe, İpi, ipin, ip","الخيط, خيط, بخيط, الوتر, وتر","מחרוזת, מיתר, מיתרים, המיתר, המיתרים","पाव, हार, सुतलि, जुड़ाहुआहै, हत्याकीएक"
flute,y,"huilua, huilu, huilun, huilusi, huilulla",y,y,"Flöte, Flötenspiel, Querflöte, Früh/ing, Flöten",y,y,y,"笛子, 笛, 裁, 吹長, \ue730","sáo, thổi, cây, muội, Brazil",y,y,y,y,y,y,y,y
whistle,y,"pilli, viheltää, pilliin, pillin, vihellys","σφυρίχτρα, σφύριγμα, σφυρίξω, σφυρίξεις, σφυρίζεις",y,"Pfeife, pfeifen, Pfeifen, Pfiff, pfeif",y,y,y,"口哨, 吹口哨, 哨子, \ue168, 吹聲",y,y,y,y,y,y,y,"לשרוק, משרוקית, המשרוקית, השריקה, במשרוקית",y
bell,y,"Kulkuset, Kellon, Bell, kellon, Sanooko","κουδουνάκι, καμπάνας, καμπάνα, καμπαναριό, καμπανάκι",y,"Glocke, Glöckchen, Klingel, Gong, Klingelt","cascabel, campanilla, Bell, campanario, sonó",y,"gong, clochette, clocher, sonnette, sonné","鐘聲, 叮噹, 敲鐘, 鈴, 印象",y,y,y,y,y,"Çanı, çanın, Çan, zilin, çanını","جرساً, الضربات, قرع, يذكرك, أصوات","הפעמון, הגואל, לפעמון, dings, הפעמונים",y
hat,y,"hattu, hatun, hattuni, hattua, hattusi",y,y,"Hut, Mütze, Kappe, Mantel, trägt",y,y,y,y,y,y,y,y,y,y,y,"הכובע, כובע, בכובע, לכובע, מהכובע","टोपी, टोप, niggah, दिखते, जराअपनीटोपीसंभालना"
crown,y,y,y,y,"Krone, krönen, Kronjuwelen, Haupt, trägt",y,y,y,y,y,"王冠, 冠, 王位, かぶ, トワイライト",y,y,y,y,y,"הכתר, כתר, בכתר, שבכתר, לכתר","मुकुट, ताज, गहने, षडयंत्रकारी, Kaikeyi-"
cloak,y,y,y,y,"Umhang, Tarnung, Mantel, tarnen, aktivieren",y,y,y,y,y,y,y,"เสื้อคลุม, ผ้าคลุม, ล่องหน, คลุม, Duquesne",y,y,y,"הגלימה, גלימה, ההסוואה, גלימת, להסוות",y
dress,"ruhára, öltözni, ruhádat, ruhád, ruhámat","mekko, mekon, mekossa, mekosta, mekkosi",y,y,"Kleid, kleiden, Hochzeitskleid, anziehen, neues",y,y,y,y,y,y,y,y,y,"Elbisen, Elbisemi, Elbiseyi, Elbiseni, Elbise",y,y,y
suit,y,"puku, puvun, Puku, puvussa, pukusi",y,"костюм, костюме, Костюм, костюма, костюмчик","Anzug, Badeanzug, Klage, Kostüm, passt",y,"tuta, armatura, completo, abito, costume",y,"西裝, 西服, 訴訟, 泳衣, 盔甲","bộ, đồ, vest, vét, giáp",y,y,y,y,"yakışmıyor, elbisen, elbisem, mayo, elbiseli","بدلة, البدلة, البذلة, بذلة, بدلتك",y,y
skirt,y,"hame, hameen, hametta, hameeni, hameesi",y,y,"Rock, Bluse, kurzen, Kleid, trägt",y,y,y,y,y,y,y,y,y,y,y,y,y
sweater,y,"pusero, villapaidan, puseron, puseroni, puserosi",y,y,"Pullover, Pulli, Sweater, gestrickt, Zieh",y,y,y,y,"áo, len, Áo, đan, áo_khoác",y,y,y,y,y,y,"הסוודר, סוודר, בסוודר, וסוודר, קשמיר",y
shirt,y,"paita, paidan, paitasi, paitaa, paitani",y,y,"Hemd, T-Shirt, Bluse, zieh, Zieh",y,y,y,y,"áo, sơ_mi, Áo, cởi, Cởi",y,y,y,y,y,y,"החולצה, חולצה, בחולצה, לחולצה, חולצתו",y
T-shirt,y,"Märkä, paidasta, paidassa, paitasi, paidan",n,n,"T-Shirt, Jeans, Zieh, trug, kaufen","camiseta, camisetas, mojadas, vaqueros, mojada",n,"T-shirts, mouillés, mouillé, blanc, portait",y,"áo, thun, áo_phông, sơ_mi, shirt","シャツ, T, Ｔ, 書, ジーンズ",y,y,"T-shirt, kaos, kaus, kaosnya, bertuliskan",n,"شيرت, قميص, القميص, قميصاً, قميصه","חולצת, חולצה, החולצה, וחולצת, שירט",n
